屏東縣林邊鄉衛生所,屏東縣,林邊鄉,Moderna,2343190010,屏東縣林邊鄉光林村和平路45號,08-8752076
世昌診所,屏東縣,長治鄉,Moderna,3543060129,屏東縣長治鄉潭頭村潭頭路251號,08-7238648
屏東縣長治鄉衛生所,屏東縣,長治鄉,Moderna,2343060017,屏東縣長治鄉進興村潭頭路3號,08-7368734
屏東縣南州鄉衛生所,屏東縣,南州鄉,Moderna,2343200011,屏東縣南州鄉溪南村人和路239號,08-8642224
大雅耳鼻喉科診所,屏東縣,屏東市,Moderna,3543014494,屏東縣屏東市瑞光里民生路6－5號1樓,08-7230707
小太陽兒科聯合診所,屏東縣,屏東市,Moderna,3543014565,屏東縣屏東市豐田里建豐路169號1樓,08-7379591
元和馨診所,屏東縣,屏東市,Moderna,3543013504,屏東縣屏東市林森路40－9號,08-7220553
正大聯合診所,屏東縣,屏東市,Moderna,3543013291,屏東縣屏東市中正路191－1號,08-7327015
民眾醫院,屏東縣,屏東市,Moderna,1543010190,屏東縣屏東市忠孝路120之1號,08-7325455
宋的祥診所,屏東縣,屏東市,Moderna,3543014172,屏東縣屏東市北興里公裕街158號,08-7651318
李福國耳鼻喉科診所,屏東縣,屏東市,Moderna,3543011975,屏東縣屏東市仁愛里中正路462號,08-7383846
尚仁診所,屏東縣,屏東市,Moderna,3543014252,屏東縣屏東市廣東路1326號1樓,08-7330296
林長興診所,屏東縣,屏東市,Moderna,3543013399,屏東縣屏東市廣東路72號,08-7236266
屏東縣屏東市衛生所,屏東縣,屏東市,Moderna,2343010017,屏東縣屏東市北興里中正路419號,08-7388701
家斌診所,屏東縣,屏東市,Moderna,3543014476,屏東縣屏東市溝美里仁愛路113號1樓,08-7365523
國仁醫院,屏東縣,屏東市,Moderna,1543010109,屏東縣屏東市民生東路12－2號,08-7223000
張文瑞診所,屏東縣,屏東市,Moderna,3543014350,屏東縣屏東市自由路581號1樓,08-7666631
博醫診所,屏東縣,屏東市,Moderna,3543014403,屏東縣屏東市崇蘭里廣東路1013號1樓,08-7325992
華正診所,屏東縣,屏東市,Moderna,3543011779,屏東縣屏東市華正路6號,08-7379036
蔡長禧診所,屏東縣,屏東市,Moderna,3543011135,屏東縣屏東市民生路12－16號1樓,08-7227766
衛生福利部屏東醫院,屏東縣,屏東市,Moderna,143010011,屏東縣屏東市自由路270號,08-7363011
優生醫療社團法人優生醫院,屏東縣,屏東市,Moderna,943010035,屏東縣屏東市華山里瑞光路三段103號,08-7382222
南門醫療社團法人南門醫院,屏東縣,恆春鎮,Moderna,943040015,屏東縣恆春鎮南門路10號,08-8894568
屏東縣恆春鎮衛生所,屏東縣,恆春鎮,Moderna,2343040015,屏東縣恆春鎮城南里文化路78號,08-8892140
洪梓策親子診所,屏東縣,恆春鎮,Moderna,3543041302,屏東縣恆春鎮環城北路181號,08-8880197
屏東縣春日鄉衛生所,屏東縣,春日鄉,Moderna,2343310012,屏東縣春日鄉春日村春日路176號,08-8780358
屏東縣泰武鄉衛生所,屏東縣,泰武鄉,Moderna,2343290015,屏東縣泰武鄉佳平村179號,08-7832059
屏東縣琉球鄉衛生所,屏東縣,琉球鄉,Moderna,2343220013,屏東縣琉球鄉本福村中山路51號,08-8612513
杏元診所,屏東縣,高樹鄉,Moderna,3543110188,屏東縣高樹鄉高樹村南興路58–1號,08-7967788
屏東縣高樹鄉衛生所,屏東縣,高樹鄉,Moderna,2343110012,屏東縣高樹鄉長榮村南昌路12–2號,08-7962026
屏東縣新埤鄉衛生所,屏東縣,新埤鄉,Moderna,2343150016,屏東縣新埤鄉新埤村中正路38號,08-7971090
江逸詩診所,屏東縣,新園鄉,Moderna,3543171378,屏東縣新園鄉仙吉村仙吉路19之1號,08-8683228
屏東縣新園鄉衛生所,屏東縣,新園鄉,Moderna,2343170018,屏東縣新園鄉仙吉村仙吉路89－2號,08-8681293
天醫診所,屏東縣,萬丹鄉,Moderna,3543051308,屏東縣萬丹鄉萬丹路一段40號,08-7772933
慈愛診所,屏東縣,萬丹鄉,Moderna,3543051344,屏東縣萬丹鄉萬壽路二段271號,08-7764028
尚禾診所,屏東縣,萬巒鄉,Moderna,3543121216,屏東縣萬巒鄉褒忠路151號1樓,08-7812963
屏東縣萬巒鄉衛生所,屏東縣,萬巒鄉,Moderna,2343120018,屏東縣萬巒鄉萬全村褒忠路16號,08-7811794
賴家醫科診所,屏東縣,萬巒鄉,Moderna,3543121190,屏東縣萬巒鄉褒忠路126號,08-7814069
瑪家診所,屏東縣,瑪家鄉,Moderna,3543281048,屏東縣瑪家鄉三和村美園巷41號,08-7993188
屏東縣瑪家鄉衛生所,屏東縣,瑪家鄉,Moderna,2343280019,屏東縣瑪家鄉北葉村風景巷86號,08-7991164
大華診所,屏東縣,潮州鎮,Moderna,3543020509,屏東縣潮州鎮永春里興隆路108號,08-7801002
大福診所,屏東縣,潮州鎮,Moderna,3543022236,屏東縣潮州鎮中山路89號1樓,08-7895556
安泰醫療社團法人潮州安泰醫院,屏東縣,潮州鎮,Moderna,943020013,屏東縣潮州鎮三星里四維路162及193號,08-7800888
屏東縣麟洛鄉衛生所,屏東縣,麟洛鄉,Moderna,2343070013,屏東縣麟洛鄉麟蹄村中山路156－1號,08-7221152
屏東縣鹽埔鄉衛生所,屏東縣,鹽埔鄉,Moderna,2343100016,屏東縣鹽埔鄉鹽北村勝利路187號,08-7932474
劉慶隆診所,屏東縣,鹽埔鄉,Moderna,3543101198,屏東縣鹽埔鄉鹽南村勝利路52之6號,08-7937178
衛生福利部澎湖醫院,澎湖縣,馬公市,Moderna,144010015,澎湖縣馬公市啟明里中正路10號,06-9261151
天主教靈醫會醫療財團法人惠民醫院,澎湖縣,馬公市,Moderna,1144010016,澎湖縣馬公市樹德路14號,06-9272318
何家庭醫學專科診所,澎湖縣,馬公市,Moderna,3544010329,澎湖縣馬公市新生路85號,06-9279218
林診所,澎湖縣,馬公市,Moderna,3544011522,澎湖縣馬公市重慶街4號,06-9278130
吳泰郎診所,澎湖縣,馬公市,Moderna,3544011620,澎湖縣馬公市東文里文山路62號,06-9212969
江明儒耳鼻喉科診所,澎湖縣,馬公市,Moderna,3544011639,澎湖縣馬公市大勇街65號,06-9276768
澎湖縣白沙鄉吉貝衛生所,澎湖縣,白沙鄉,Moderna,2344030031,澎湖縣白沙鄉吉貝村8－13號,06-9911430
澎湖縣白沙鄉鳥嶼衛生所,澎湖縣,白沙鄉,Moderna,2344030022,澎湖縣白沙鄉鳥嶼村漁港新村3號,06-9916092
澎湖縣望安鄉將軍衛生所,澎湖縣,望安鄉,Moderna,2344050024,澎湖縣望安鄉將軍村12鄰將軍澳1之3號,06-9902066
新北市汐止區衛生所,新北市,汐止區,Moderna,2331110011,新北市汐止區新台五路1段266號地下1樓．地上1至4樓,02-26412030
雙雙小兒科診所,新北市,汐止區,Moderna,3531112609,新北市汐止區明峰街143號,02-26955777
德祐小兒科診所,新北市,汐止區,Moderna,3531112887,新北市汐止區福德一路117之1號1樓,02-26945180
弘人小兒科診所,新北市,汐止區,Moderna,3531110623,新北市汐止區福德二路152號1樓,02-26932439
馨生婦產科小兒科診所,新北市,汐止區,Moderna,3531113017,新北市汐止區福德二路215號1樓、215之1號1樓,02-26927666
福德診所,新北市,汐止區,Moderna,3531112618,新北市汐止區中興里福德二路171號,02-26959877
顏志瑋診所,新北市,汐止區,Moderna,3531112841,新北市汐止區建成路18號1樓,02-26417999
洪振凱診所,新北市,汐止區,Moderna,3531112725,新北市汐止區樟樹一路136號,02-26918877
育和診所,新北市,汐止區,Moderna,3531113366,新北市汐止區中正路31號1、2樓,02-26486803
祥和診所,新北市,汐止區,Moderna,3531112654,新北市汐止區建成路37巷13號,02-86422558
宏欣診所,新北市,汐止區,Moderna,3531113268,新北市汐止區大同路2段221號1樓,02-26918678
蘇小兒科診所,新北市,汐止區,Moderna,3531112216,新北市汐止區福德一路245號,02-26935513
新台安診所,新北市,汐止區,Moderna,3531112958,新北市汐止區新台五路1段178號1樓,02-26917810
大同耳鼻喉科診所,新北市,汐止區,Moderna,3531112707,新北市汐止區大同路2段300號1樓及298號2樓之1,02-26919292
楊內科小兒科診所,新北市,汐止區,Moderna,3531110025,新北市汐止區汐萬路1段25號,02-26420233
羅小兒科診所,新北市,汐止區,Moderna,3531110874,新北市汐止區忠孝東路244號1樓,02-86918828
朝芳診所,新北市,汐止區,Moderna,3531112583,新北市汐止區中正路8號,02-26427297
蘇怡菁家醫科診所,新北市,汐止區,Moderna,3531113277,新北市汐止區仁愛路43號1樓,02-26423136
國泰醫療財團法人汐止國泰綜合醫院,新北市,汐止區,Moderna,1131110516,新北市汐止區建成路59巷2號地下4樓至地上12樓,02-26482121
新北市烏來區衛生所,新北市,烏來區,Moderna,2331290014,新北市烏來區新烏路5段109號,02-26617200
幸福小兒科診所,新北市,新莊區,Moderna,3531063647,新北市新莊區幸福路729號,02-29919474
祐幼小兒科診所,新北市,新莊區,Moderna,3531061643,新北市新莊區民安西路21號1樓,02-22030993
軒琪耳鼻喉科診所,新北市,新莊區,Moderna,3531066068,新北市新莊區富國路15號1樓,02-29072366
育慶小兒科診所,新北市,新莊區,Moderna,3531065561,新北市新莊區民安西路195－1號1樓,02-82016758
王榮文小兒科診所,新北市,新莊區,Moderna,3531061830,新北市新莊區中和街149號,02-89915595
巧兒親子診所,新北市,新莊區,Moderna,3531066166,新北市新莊區建中街92號1樓,02-22779263
新莊惠欣婦產科小兒科診所,新北市,新莊區,Moderna,3531063969,新北市新莊區建中街72－1號1、2、3、4樓,02-29902299
聯安診所,新北市,新莊區,Moderna,3531061278,新北市新莊區中正路330號1樓、330－1號2樓,02-29986191
昌明耳鼻喉科診所,新北市,新莊區,Moderna,3531065945,新北市新莊區昌明街80號1樓,02-89920100
弘久診所,新北市,新莊區,Moderna,3531065730,新北市新莊區新泰路57號1樓至2樓,02-22040904
寶祥診所,新北市,新莊區,Moderna,3531066273,新北市新莊區中平路53號1樓至2樓,02-29960303
聯福診所,新北市,新莊區,Moderna,3531061867,新北市新莊區八德里民安路232號1、2樓,02-22014370
晉安診所,新北市,新莊區,Moderna,3531065294,新北市新莊區中正路700之24號1樓、2樓,02-29061510
中心診所,新北市,新莊區,Moderna,3531063601,新北市新莊區中港路321號1樓,02-22765992
輔大診所,新北市,新莊區,Moderna,3531064528,新北市新莊區中正路510號（醫學綜合大樓1樓）,02-29052526
鄭骨科耳鼻喉科診所,新北市,新莊區,Moderna,3531060324,新北市新莊區中港路263號1、2樓及267巷1號1、2樓,02-29929191
錦明耳鼻喉科診所,新北市,新莊區,Moderna,3531061938,新北市新莊區民安路195號,02-22028080
王建民耳鼻喉科診所,新北市,新莊區,Moderna,3531061438,新北市新莊區幸福路26號,02-29907055
中平耳鼻喉科診所,新北市,新莊區,Moderna,3531066004,新北市新莊區中平路29號1樓．31號2樓．33號2樓,02-29977307
廣田耳鼻喉科診所,新北市,新莊區,Moderna,3531064126,新北市新莊區中宏里幸福路777號1樓,02-29906799
和新診所,新北市,新莊區,Moderna,3531065221,新北市新莊區八德街3號1樓,02-22071315
王中煌診所,新北市,新莊區,Moderna,3531061009,新北市新莊區新泰路194號1、2樓,02-22767366
幸福呂耳鼻喉科診所,新北市,新莊區,Moderna,3531061769,新北市新莊區幸福路529號,02-29906923
春詠診所,新北市,新莊區,Moderna,3531064457,新北市新莊區南港里龍安路278巷2號1樓,02-22033355
邱欽斌小兒科診所,新北市,新莊區,Moderna,3531061045,新北市新莊區民安路141號1樓、141－1號2樓,02-22050717
至祥診所,新北市,新莊區,Moderna,3531065712,新北市新莊區龍安路78號1樓,02-29047700
新莊徐耳鼻喉科診所,新北市,新莊區,Moderna,3531061876,新北市新莊區中平路373號1樓,02-29907505
林復森耳鼻喉科診所,新北市,新莊區,Moderna,3531062195,新北市新莊區民安路220號,02-22011378
安田耳鼻喉科診所,新北市,新莊區,Moderna,3531066228,新北市新莊區自信街51號1樓,02-29948585
上和耳鼻喉科診所,新北市,新莊區,Moderna,3531064519,新北市新莊區中平里中和街150號,02-29907980
衛生福利部臺北醫院,新北市,新莊區,Moderna,131060029,新北市新莊區思源路127號、新北巿新莊區長春街6號2樓、3樓,02-22765566
衛生福利部樂生療養院,新北市,新莊區,Moderna,131060010,新北市新莊區中正路794號及桃園縣龜山鄉萬壽路1段50巷2號,02-82006600
新泰綜合醫院,新北市,新莊區,Moderna,1531060180,新北市新莊區新樹路176號,02-29962121
新仁醫療社團法人新仁醫院,新北市,新莊區,Moderna,931060016,新北市新莊區中正路395號、福海街24巷1號,02-22017212
張海山診所,花蓮縣,花蓮市,BioNTech,3545012827,花蓮縣花蓮市中正路191號1樓,03-8353777
江洱診所,花蓮縣,花蓮市,BioNTech,3545012327,花蓮縣花蓮市建國路252號,03-8311717
國泰聯合診所,花蓮縣,花蓮市,BioNTech,3545011142,花蓮縣花蓮市中華路459號,03-8542031
宏恩診所,花蓮縣,花蓮市,BioNTech,3545010663,花蓮縣花蓮市和平路500號,03-8328406
宏卿診所,花蓮縣,花蓮市,BioNTech,3545012309,花蓮縣花蓮市國光里林森路417號,03-8342233
林建中診所,花蓮縣,花蓮市,BioNTech,3545010707,花蓮縣花蓮市中福路193號,03-8361638
謝文億診所,花蓮縣,花蓮市,BioNTech,3545012523,花蓮縣花蓮市中美路63號,03-8336635
嘉光耳鼻喉科診所,花蓮縣,花蓮市,BioNTech,3545011124,花蓮縣花蓮市明禮路71之5號,03-8341440
呂小兒科診所,花蓮縣,花蓮市,BioNTech,3545010547,花蓮縣花蓮市博愛街201號,03-8329341
中正診所,花蓮縣,花蓮市,BioNTech,3545012578,花蓮縣花蓮市中正路170號1樓,03-8316655
陳建發耳鼻喉科診所,花蓮縣,花蓮市,BioNTech,3545012434,花蓮縣花蓮市中美路77之2號,03-8246119
陳耳鼻喉科診所,花蓮縣,花蓮市,BioNTech,3545012354,花蓮縣花蓮市光復街15號,03-8322878
何毓基神經外科復健診所,花蓮縣,花蓮市,BioNTech,3545012854,花蓮縣花蓮市和平路266號1－3樓,03-38335158
全人診所,花蓮縣,花蓮市,BioNTech,3545012498,花蓮縣花蓮市中福路158號,03-8358568
佳佳診所,花蓮縣,花蓮市,BioNTech,3545011222,花蓮縣花蓮市中山路142之7號,03-8337437
珍幸福診所,花蓮縣,花蓮市,BioNTech,3545012845,花蓮縣花蓮市中正路296號1樓,03-8328291
至善診所,花蓮縣,花蓮市,BioNTech,3545012532,花蓮縣花蓮市中正路46號,03-8338006
張曉昇診所,花蓮縣,吉安鄉,BioNTech,3545050345,花蓮縣吉安鄉永安村建國路2段223之1號,03-8576771
光鹽診所,花蓮縣,吉安鄉,BioNTech,3545051468,花蓮縣吉安鄉中山路3段281號,03-8534305
康寧診所,花蓮縣,吉安鄉,BioNTech,3545051404,花蓮縣吉安鄉慶豐村中山路3段386號,03-8530910
博幼診所,花蓮縣,吉安鄉,BioNTech,3545051511,花蓮縣吉安鄉建國路一段19號,03-8569866
自強耳鼻喉科診所,花蓮縣,吉安鄉,BioNTech,3545051502,花蓮縣吉安鄉北昌村自強路568號,03-8561277
福康診所,花蓮縣,吉安鄉,BioNTech,3545051637,花蓮縣吉安鄉吉安路二段41號,03-8547668
中心診所,花蓮縣,吉安鄉,BioNTech,3545051495,花蓮縣吉安鄉中央路三段566號,03-8581096
禾心診所,花蓮縣,壽豐鄉,BioNTech,3545061197,花蓮縣壽豐鄉豐山村中山路225號,03-8650020
嗎哪診所,花蓮縣,鳳林鎮,BioNTech,3545021184,花蓮縣鳳林鎮林榮里林榮路169號1樓,03-8772780、03-8772780
啟光診所,花蓮縣,玉里鎮,BioNTech,3545031260,花蓮縣玉里鎮中華路74號,03-8880468
崇心診所,花蓮縣,秀林鄉,BioNTech,3545110846,花蓮縣秀林鄉崇德村崇德路100之8號,03-8621866
富原診所,花蓮縣,瑞穗鄉,BioNTech,3545091131,花蓮縣瑞穗鄉富源村中正路156號,03-8812111
初鹿診所,臺東縣,卑南鄉,BioNTech,3546041171,臺東縣卑南鄉明峰村文泰路8號,089-570618
衛生福利部臺東醫院,臺東縣,台東市,BioNTech,146010013,臺東縣臺東市五權街1號,089-324112
李惠雄內科診所,臺東縣,台東市,BioNTech,3546012269,臺東縣臺東市中正路334號,089-361850
李旺駿耳鼻喉科診所,臺東縣,台東市,BioNTech,3546012358,臺東縣臺東市中華路一段317號,089-310568
李文正內科診所,臺東縣,台東市,BioNTech,3546010407,臺東縣臺東市中正路295號,089-323920
尤憲明內科小兒科診所,臺東縣,台東市,BioNTech,3546012072,臺東縣臺東市中華路1段396號,089-323306
小太陽小兒科診所,臺東縣,台東市,BioNTech,3546012376,臺東縣臺東市光明路124號,089-349106
蔡明宏心臟內科診所,臺東縣,台東市,BioNTech,3546010416,臺東縣臺東市更生路199號,089-346882
關強內科診所,臺東縣,台東市,BioNTech,3546010765,臺東縣臺東市中山路224號,089-343588
裕成耳鼻喉科診所,高雄市,三民區,BioNTech,3507321194,高雄市三民區裕誠路90號1樓,07-3457832
建欣診所,高雄市,三民區,BioNTech,3507321283,高雄市三民區正興路213號1樓,07-3808856
范雅修小兒科診所,高雄市,三民區,BioNTech,3502052498,高雄市三民區平等路163號一樓,07-3876366
吉星小兒科診所,高雄市,三民區,BioNTech,3502052523,高雄市三民區天祥一路135－1號1樓,07-3487936
羅韻珊小兒科診所,高雄市,三民區,BioNTech,3502051642,高雄市三民區大豐二路110-1號1樓,07-3870430
郭建宏小兒科診所,高雄市,三民區,BioNTech,3507320080,高雄市三民區義華路394號1樓,07-3982606
王婦產科診所,高雄市,三民區,BioNTech,3502052149,高雄市三民區九如一路440，442，444號1，2樓,07-3873979
謝明容耳鼻喉科診所,高雄市,三民區,BioNTech,3502054465,高雄市三民區大昌二路142號1樓,07-3973999
儲昭仁耳鼻喉科診所,高雄市,三民區,BioNTech,3502052345,高雄市三民區九如一路854號1樓,07-3890470
董金山診所,高雄市,三民區,BioNTech,3502050378,高雄市三民區本武里大昌二路544號,07-3833405
王漢卿小兒科診所,高雄市,三民區,BioNTech,3502052292,高雄市三民區寶國里陽明路132號1樓,07-3877918
曾柏彰診所,高雄市,三民區,BioNTech,3507320688,高雄市三民區鼎力路339號1樓,07-3103216
陳志宇診所,高雄市,三民區,BioNTech,3507321023,高雄市三民區覺民路186號1樓,07-3833282
蕭瑞榮小兒科診所,高雄市,三民區,BioNTech,3502051375,高雄市三民區建工路531．533號1樓,07-3867121
張殷彰診所,高雄市,三民區,BioNTech,3502054125,高雄市三民區建工路531．533號一樓,07-3867121
柳雱邁診所,高雄市,三民區,BioNTech,3507320035,高雄市三民區大順二路96號1樓,07-3895640
緯立診所,高雄市,三民區,BioNTech,3507321247,高雄市三民區建元路30號1樓,07-3850785
真善美診所,高雄市,三民區,BioNTech,3507320375,高雄市三民區覺民路69號1樓2樓,07-3945929
曾繁英診所,高雄市,三民區,BioNTech,3502051348,高雄市三民區自立一路267號,07-3111048
樂田耳鼻喉科診所,高雄市,三民區,BioNTech,3507320642,高雄市三民區熱河一街365號1樓,07-3115999
高鳳診所,高雄市,三民區,BioNTech,3502054652,高雄市三民區灣中街328號一樓,07-3865481
怡碩耳鼻喉科診所,高雄市,三民區,BioNTech,3507321407,高雄市三民區建工路589號1樓,07-3808169
王俊仁耳鼻喉科診所,高雄市,三民區,BioNTech,3502052121,高雄市三民區本揚里陽明路416號1樓,07-3959039
建成診所,高雄市,三民區,BioNTech,3507321130,高雄市三民區文濱路20號1樓,07-7809696
鼎山診所,高雄市,三民區,BioNTech,3507320277,高雄市三民區鼎華路12號1～2樓,07-3800000
國安診所,高雄市,三民區,BioNTech,3507320955,高雄市三民區建興路193號1－2樓,07-3865379
福欣耳鼻喉科診所,高雄市,三民區,BioNTech,3507321292,高雄市三民區十全一路365號1樓,07-3120269
黃志維耳鼻喉科診所,高雄市,三民區,BioNTech,3502054527,高雄市三民區建工路608號1樓,07-3947605
徐樹本小兒科診所,高雄市,三民區,BioNTech,3502051599,高雄市三民區建興路373號,07-3867833
育明診所,高雄市,三民區,BioNTech,3502052694,高雄市三民區民族一路537號一樓．二樓,07-3478461
元成診所,高雄市,三民區,BioNTech,3502055293,高雄市三民區寶業里陽明路81號1樓,07-3903808
崇田耳鼻喉科診所,高雄市,三民區,BioNTech,3507320231,高雄市三民區建工路302號1樓,07-3899900
維揚耳鼻喉科診所,高雄市,三民區,BioNTech,3507321390,高雄市三民區熱河一街402號1樓,07-3131066
四季台安醫院,高雄市,三民區,BioNTech,1502051426,高雄市三民區聯興路157號，聯興路145巷1號1－3樓,07-3983000
愛仁醫療社團法人愛仁醫院,高雄市,三民區,BioNTech,907320012,高雄市三民區民族一路45號1樓至4樓及49．51號1樓至4樓,07-3115159
新高醫院,高雄市,三民區,BioNTech,1507320015,高雄市三民區莊敬路288號1-9樓,07-3828814
和平醫療社團法人進興診所,高雄市,三民區,BioNTech,4107320010,高雄市三民區九如一路171號1樓,07-3869559
僾彼高榮育仁診所,高雄市,三民區,BioNTech,3507320133,高雄市三民區九如一路148號1-3樓,07-3891080
偉倫小兒科診所,高雄市,三民區,BioNTech,3502055499,高雄市三民區鼎山街256號1樓,07-3800333
承安耳鼻喉科診所,高雄市,三民區,BioNTech,3502054929,高雄市三民區力行路250號1樓,07-3160789
陳豊源耳鼻喉科診所,高雄市,三民區,BioNTech,3502051053,高雄市三民區建工路648號,07-3870120
川惠診所,高雄市,三民區,BioNTech,3507321087,高雄市三民區文安南街78號1樓,07-7807811
尊德診所,高雄市,三民區,BioNTech,3507321381,高雄市三民區博愛一路223－1號2樓,07-3226777
莊永昌診所,高雄市,三民區,BioNTech,3502051544,高雄市三民區建工路332號,07-3922289
呂佳群耳鼻喉科診所,高雄市,三民區,BioNTech,3502052336,高雄市三民區大昌二路305號一樓,07 3832988
吉田診所,高雄市,大社區,BioNTech,3542090276,高雄市大社區中山路72號,07-3543381
富安診所,高雄市,大社區,BioNTech,3542090150,高雄市大社區神農里金龍路138號,07-3528996
德全診所,高雄市,大社區,BioNTech,3542090203,高雄市大社區金龍路375號,07-3529868
王裕郎小兒科診所,高雄市,大社區,BioNTech,3542090329,高雄市大社區中山路317號,07-3550619
圓明診所,高雄市,大寮區,BioNTech,3542062156,高雄市大寮區義仁里鳳林一路147號,07-6433298
洪耳鼻喉科診所,高雄市,大寮區,BioNTech,3542060401,高雄市大寮區忠義里鳳林四路156號,07-7861305
大鋐診所,高雄市,大寮區,BioNTech,3507060043,高雄市大寮區中庄里鳳屏一路492號1樓,07-7038188
大順診所,高雄市,大寮區,BioNTech,3542060769,高雄市大寮區鳳屏一路562號,07-7038417
鳳信診所,高雄市,大寮區,BioNTech,3542061917,高雄市大寮區鳳屏一路578號1－2樓,07-7036751
張文豪診所,高雄市,大寮區,BioNTech,3542061944,高雄市大寮區會社里力行路1－12號1樓,07-7816276
嘉德耳鼻喉科診所,高雄市,大寮區,BioNTech,3542062147,高雄市大寮區鳳屏一路441、443號,07-7022626
大承耳鼻喉科診所,高雄市,大寮區,BioNTech,3542062307,高雄市大寮區鳳屏一路464號1樓,07-7013668
喉康診所,高雄市,大寮區,BioNTech,3507060070,高雄市大寮區中庄里仁愛路82號1樓,07-7017100
宜和內兒科診所,高雄市,大寮區,BioNTech,3542060189,高雄市大寮區會社里鳳林三路341號,07-7816825
佳和耳鼻喉科診所,高雄市,大寮區,BioNTech,3507060034,高雄市大寮區鳳林三路516號,07-7821500
詠新耳鼻喉科診所,高雄市,大寮區,BioNTech,3507060052,高雄市大寮區中庄里鳳屏一路690號1樓,07-7032000
杏安診所,高雄市,大寮區,BioNTech,3542062290,高雄市大寮區琉球里林厝路53號1樓,07-7810565
瑞生醫院,高雄市,大寮區,BioNTech,1542061148,高雄市大寮區鳳林四路192號,07-7835175
張桐榮診所,高雄市,大寮區,BioNTech,3542061953,高雄市大寮區鳳林三路573．575號,07-7825382
佛光聯合診所,高雄市,大樹區,BioNTech,3542071315,高雄市大樹區興田里興田路154號1樓,07-6562605
洪清中兒科診所,高雄市,小港區,BioNTech,3502110646,高雄市小港區二苓路192號1樓,07-8063773
孔鳳診所,高雄市,小港區,BioNTech,3507380111,高雄市小港區孔鳳路571號1樓,07-7910311
大雄診所,高雄市,小港區,BioNTech,3507380193,高雄市小港區二苓路156、158號1樓,07-8015808
長慶小兒科診所,高雄市,小港區,BioNTech,3507380068,高雄市小港區漢民路413號1樓,07-8068170
施晉南診所,高雄市,小港區,BioNTech,3502110637,高雄市小港區平治街1號、1之1號,07-8021622
蔡坤霖小兒科診所,高雄市,小港區,BioNTech,3502111956,高雄市小港區二苓路148號1樓,07-8030816
大佑診所,高雄市,小港區,BioNTech,3507380157,高雄市小港區平和路26－1號,07-8218162
朝陽耳鼻喉科診所,高雄市,小港區,BioNTech,3507380040,高雄市小港區平和路144號1樓146號1樓,07-8311228
柯芳蓉黃麗瑛小兒科診所,高雄市,小港區,BioNTech,3502111929,高雄市小港區漢民路716號一樓,07-8053077
蔡聰慶診所,高雄市,小港區,BioNTech,3502110440,高雄市小港區孔鳳路239號,07-7914257
高雄市立小港醫院（委託財團法人私立高雄醫學大學經營）,高雄市,小港區,BioNTech,1102110011,高雄市小港區山明里山明路482號Ｂ1－10樓,07-8036783
戴銘浚婦兒醫院,高雄市,小港區,BioNTech,1502111089,高雄市小港區宏平路661號1至7樓,07-8061289
大林診所,高雄市,仁武區,BioNTech,3507080161,高雄市仁武區仁雄路9號1樓,07-3718528
仁同小兒科診所,高雄市,仁武區,BioNTech,3507080205,高雄市仁武區永仁街694號1樓,07-3734890
易生診所,高雄市,仁武區,BioNTech,3542080190,高雄市仁武區文武里中華路306號,07-3746901
劉內兒科診所,高雄市,仁武區,BioNTech,3542080047,高雄市仁武區灣內里仁心路6號1樓,07-3718727
