凱旋診所,高雄市,鳳山區,Moderna,3542011382,高雄市鳳山區新富里凱旋路261號,07-7637639
錦明小兒科診所,高雄市,鳳山區,Moderna,3542011364,高雄市鳳山區自強二路171號,07-7683688
瑞文診所,高雄市,鳳山區,Moderna,3507010927,高雄市鳳山區新富路330號1樓,07-7675688
江泰興耳鼻喉科診所,高雄市,鳳山區,Moderna,3542010090,高雄市鳳山區忠義里澄清路97號,07-7422296
福誠耳鼻喉科診所,高雄市,鳳山區,Moderna,3507011031,高雄市鳳山區五福里五甲三路205號1－2樓,07-8125257
聖恩診所,高雄市,鳳山區,Moderna,3507010632,高雄市鳳山區五甲二路395號、397號1樓,07-7219819
黃大沅小兒科診所,高雄市,鳳山區,Moderna,3542012076,高雄市鳳山區青年路二段468號,07-7679299
國民小兒科診所,高雄市,鳳山區,Moderna,3542010723,高雄市鳳山區縣口里中正路37號,07-7427925
和成診所,高雄市,鳳山區,Moderna,3507010990,高雄市鳳山區南成里和成路71號1樓,07-7961900
佑寧耳鼻喉專科診所,高雄市,鳳山區,Moderna,3507011068,高雄市鳳山區建國路三段167號1樓,07-7102110
元富診所,高雄市,鳳山區,Moderna,3542014525,高雄市鳳山區新富路237號1．2樓,07-7638666
李威德診所,高雄市,鳳山區,Moderna,3542012352,高雄市鳳山區五甲三路48號,07-8227676
黃榮隆診所,高雄市,鳳山區,Moderna,3542013886,高雄市鳳山區文衡路460號,07-7767700
新石津診所,高雄市,鳳山區,Moderna,3542014785,高雄市鳳山區自強二路112號,07-7682288
楊誠恕診所,高雄市,鳳山區,Moderna,3507010954,高雄市鳳山區工協街47號1樓,07-7016090
吳萍建小兒科診所,高雄市,鳳山區,Moderna,3507010249,高雄市鳳山區瑞竹里瑞明街90巷8號1樓,07-7191180
大東醫院,高雄市,鳳山區,Moderna,1542010052,高雄市鳳山區三民里光遠路171－2號,07-7463762
惠德醫院,高雄市,鳳山區,Moderna,1542011237,高雄市鳳山區福祥街81號1．2樓,07-8126000
鳳山全民診所,高雄市,鳳山區,Moderna,3542011800,高雄市鳳山區博愛路328號,07-7037038
聖壹診所,高雄市,鳳山區,Moderna,3507010678,高雄市鳳山區瑞興路482號1樓及490號1樓,07-7014755
新高鳳醫院,高雄市,鳳山區,Moderna,1507010014,高雄市鳳山區光遠路360號1－7樓,07-7472320
祐幼小兒科診所,高雄市,鳳山區,Moderna,3542013840,高雄市鳳山區八德路296巷28號1樓,07-7769977
大欣診所,高雄市,鳳山區,Moderna,3507010025,高雄市鳳山區文化路25號1樓,07-7993009
張晉源耳鼻喉科診所,高雄市,鳳山區,Moderna,3542014221,高雄市鳳山區文衡路451號1樓,07-7775450
孟昌診所,高雄市,鳳山區,Moderna,3507010178,高雄市鳳山區海洋二路39號1樓,07-7650908
唯均耳鼻喉科診所,高雄市,鳳山區,Moderna,3542011935,高雄市鳳山區海洋二路139號,07-7638199
韓台基診所,高雄市,鳳山區,Moderna,3542011506,高雄市鳳山區新甲里新富路333號,07-7662525
陳彥伸耳鼻喉科診所,高雄市,鳳山區,Moderna,3507010712,高雄市鳳山區五甲二路346號1樓,07-7277110
陳重志聯合診所,高雄市,鳳山區,Moderna,3542014098,高雄市鳳山區光復路一段139號,07-7427329
葉耳鼻喉科診所,高雄市,鳳山區,Moderna,3542014927,高雄市鳳山區青年路二段373號1樓,07-7778783
何鴻鈞診所,高雄市,鳳山區,Moderna,3542011864,高雄市鳳山區林森路324號,07-7716819
賴其盈小兒科診所,高雄市,鳳山區,Moderna,3507010883,高雄市鳳山區自由路136－1號1樓,07-7107998
上承診所,高雄市,鳳山區,Moderna,3507011077,高雄市鳳山區光復路一段48號1樓,07-7102666
杏和醫院,高雄市,鳳山區,Moderna,1542011282,高雄市鳳山區五甲二路385號、387號、389號、391號,07-7613111
高雄市立鳳山醫院（委託長庚醫療財團法人經營）,高雄市,鳳山區,Moderna,1142010518,高雄市鳳山區經武路42號、42－1號,07-7418151
高丹榕診所,高雄市,鳳山區,Moderna,3507010650,高雄市鳳山區光復路2段223號1樓,07-7475556
誠愛診所,高雄市,鳳山區,Moderna,3507010794,高雄市鳳山區誠義里誠愛路1號1樓,07-7556028
正心診所,高雄市,橋頭區,Moderna,3542111396,高雄市橋頭區隆豐路170號1樓,07-6128080
孫琮淵診所,高雄市,橋頭區,Moderna,3542111378,高雄市橋頭區仕隆里成功南路79號,07-6130567
泰和醫院,高雄市,橋頭區,Moderna,1542110020,高雄市橋頭區橋頭里成功路101號,07-6111128
義大醫療財團法人義大醫院,高雄市,燕巢區,Moderna,1142120001,高雄市燕巢區角宿里義大路1號,07-6150011
建佑醫院,高雄市,林園區,Moderna,1542050056,高雄市林園區東林西路360，362號，399號，407巷7號,07-6437901
高美診所,高雄市,美濃區,Moderna,3507040032,高雄市美濃區成功路139號4、5、6樓,07-6815566
長庚醫療財團法人高雄長庚紀念醫院,高雄市,鳥松區,Moderna,1142100017,高雄市鳥松區大埤路123號,07-7317123
豐穎診所,高雄市,鳥松區,Moderna,3507100015,高雄市鳥松區中正路355－2號1樓,07-7316996
聯安診所,高雄市,鳥松區,Moderna,3542101185,高雄市鳥松區中正路343號,07-7335076
謝秋梅診所,桃園市,桃園區,Moderna,3532012635,桃園市桃園區大有路428號1樓、3樓,03-3151100
聖昌診所,桃園市,桃園區,Moderna,3532015529,桃園市桃園區大業路一段318號1樓,03-3150732
亞聯親子診所,桃園市,桃園區,Moderna,3532016026,桃園市桃園區大興西路2段82－1號1樓,03-3013088
聖德診所,桃園市,桃園區,Moderna,3532016517,桃園市桃園區大興西路二段69巷3號1樓,03-3562319
永欣診所,桃園市,桃園區,Moderna,3532014808,桃園市桃園區大興路193號1樓,03-3587669
李柏鋒診所,桃園市,桃園區,Moderna,3532014782,桃園市桃園區中山路八0七號,03-2207480
蕭閔誌診所,桃園市,桃園區,Moderna,3532014951,桃園市桃園區中平路99號1樓,03-2207911
鴻林耳鼻喉科診所,桃園市,桃園區,Moderna,3532012966,桃園市桃園區中正路567號,03-3377088
何翊菁診所,桃園市,桃園區,Moderna,3532014773,桃園市桃園區中埔六街123號,03-3551192
吉兒診所,桃園市,桃園區,Moderna,3532014871,桃園市桃園區民光東路107號,03-3339995
臺北榮民總醫院桃園分院,桃園市,桃園區,Moderna,632010014,桃園市桃園區成功路三段100號,03-3384889
曹景雄小兒科診所,桃園市,桃園區,Moderna,3532014675,桃園市桃園區延平路113號,03-2183141
禾安診所,桃園市,桃園區,Moderna,3532015713,桃園市桃園區延平路115號,03-3761051
明欣診所,桃園市,桃園區,Moderna,3532015976,桃園市桃園區南平路206-2號,03-3169189
沙爾德聖保祿修女會醫療財團法人聖保祿醫院,桃園市,桃園區,Moderna,1132010024,桃園市桃園區建新街123號,03-3613141
孫德金小兒科診所,桃園市,桃園區,Moderna,3532012948,桃園市桃園區桃鶯路209號1樓,03-3778759
蘇裕哲診所,桃園市,桃園區,Moderna,3532014684,桃園市桃園區國鼎一街36號,03-3692335
顧小兒科診所,桃園市,桃園區,Moderna,3532012975,桃園市桃園區國際路一段1146號,03-2202364
合康診所,桃園市,桃園區,Moderna,3532012493,桃園市桃園區國際路二段10號,03-3703009
桃庚聯合診所,桃園市,桃園區,Moderna,3532012591,桃園市桃園區國際路二段38號1樓、2樓,03- 3705119
聯新國際醫院桃新分院,桃園市,桃園區,Moderna,1532010120,桃園市桃園區復興路195號；桃園市南海街7號,03-3325678
佳祐診所,桃園市,桃園區,Moderna,3532011852,桃園市桃園區復興路402號,03-3382280
禾馨桃園婦幼診所,桃園市,桃園區,Moderna,3532018128,桃園市桃園區經國2路36號1－3樓,03-3465333
敏盛綜合醫院,桃園市,桃園區,Moderna,1532011154,桃園市桃園區經國路168號、三民路三段106號,03-3179599
愛兒親子診所,桃園市,桃園區,Moderna,3532017925,桃園市桃園區慈文路192號1樓,03-3554766
陸勇亮診所,桃園市,桃園區,Moderna,3532011414,桃園市桃園區大林里桃鶯路273號,03-3623368
尚群診所,桃園市,桃園區,Moderna,3532014157,桃園市桃園區三民路三段512號,03-3672348
大興維格內科診所,桃園市,桃園區,Moderna,3532016286,桃園市桃園區大興西路二段131、135號1樓,03-3020185
德仁醫院,桃園市,桃園區,Moderna,1532011163,桃園市桃園區桃鶯路245號,03-3617985
胡錕杰診所,桃園市,桃園區,Moderna,3532014924,桃園市桃園區中埔二街121號1樓,03-3025371
惠生保安婦幼診所,桃園市,桃園區,Moderna,3532017818,桃園市桃園區介壽路193號1至2樓、493之2號1至3樓,03-2185678
永安診所,桃園市,桃園區,Moderna,3532010462,桃園市桃園區永安路４６０號,03 3326415
美劭診所,桃園市,桃園區,Moderna,3532014666,桃園市桃園區永安路三八九號,3368787
正典診所,桃園市,桃園區,Moderna,3532014595,桃園市桃園區莊敬路一段342之5號一樓,03-3560889
同德診所,桃園市,桃園區,Moderna,3532017238,桃園市桃園區永安北路422號1樓之1,03-3577766
吳鎮宇親子耳鼻喉科診所,桃園市,桃園區,Moderna,3532014399,桃園市桃園區中山路824號1樓、826號1樓,03-2201111
聖昕診所,桃園市,桃園區,Moderna,3532017943,桃園市桃園區大興西路二段76巷10號1樓,03-3021278
林振實小兒診所,桃園市,桃園區,Moderna,3532012582,桃園市桃園區育樂街23號1樓,(03) 3319618
正興診所,桃園市,桃園區,Moderna,3532016142,桃園市桃園區桃鶯路452號,03-3635453
柯福順耳鼻喉科診所,桃園市,桃園區,Moderna,3532012804,桃園市桃園區中山路613號,03-2201122
晨暘診所,桃園市,桃園區,Moderna,3532016446,桃園市桃園區寶山街235號1樓之2,03-3175777
勤業診所,桃園市,桃園區,Moderna,3532017961,桃園市桃園區中正路387號1樓、2樓及地下室暨389號1樓、2樓及地下室,03-3337233
欣欣診所,桃園市,桃園區,Moderna,3532015903,桃園市桃園區中正路1009號1樓,03-3257780
家和診所,桃園市,桃園區,Moderna,3532016571,桃園市桃園區大業路2段13號1樓,03-3575170
智元診所,桃園市,桃園區,Moderna,3532015270,桃園市桃園區大業路一段333號,03-3150708
永晉診所,桃園市,桃園區,Moderna,3532015556,桃園市桃園區上海路110號1樓,03-3441199
慈文診所,桃園市,桃園區,Moderna,3532015896,桃園市桃園區中正路566號1、2樓,03-3355482
偉勝耳鼻喉科診所,桃園市,桃園區,Moderna,3532014308,桃園市桃園區中正路558號一樓,03-3473858
新安診所,桃園市,平鎮區,Moderna,3532101888,桃園市平鎮區中豐路208號1樓,(03)4683553
立群診所,桃園市,平鎮區,Moderna,3532102385,桃園市平鎮區中豐路山頂段27號1樓、2樓,03-4191137
聯恩診所,桃園市,平鎮區,Moderna,3532102321,桃園市平鎮區中豐路南勢二段100號1樓暨102號1樓,03-4395633
宋俊宏婦幼醫院,桃園市,平鎮區,Moderna,1532101108,桃園市平鎮區民族路199號,03-4020999
維賢診所,桃園市,平鎮區,Moderna,3532102287,桃園市平鎮區和平路123號1樓及125號1、2樓,03-4683636
秉坤婦幼醫院,桃園市,平鎮區,Moderna,1532101117,桃園市平鎮區延平路2段129號,03-4025866
河助璽恒診所,桃園市,平鎮區,Moderna,3532102303,桃園市平鎮區延平路2段30號1樓,03-4927588
聯新國際醫院,桃園市,平鎮區,Moderna,1532100049,桃園市平鎮區廣泰路77號、延平路二段430巷115號,03-4941234
延平診所,桃園市,平鎮區,Moderna,3532102401,桃園市平鎮區延平路二段430巷79-16號1樓,03-4918188
高俊傑診所,桃園市,平鎮區,Moderna,3532101860,桃園市平鎮區民族路237號,03-4021515
佳杏診所,桃園市,平鎮區,Moderna,3532102189,桃園市平鎮區民族路237號,03-4021515
新永和醫院,桃園市,平鎮區,Moderna,1532100012,桃園市平鎮區延平路一段81號,03-4220606
陽光耳鼻喉科診所,桃園市,平鎮區,Moderna,3532102394,桃園市平鎮區復興街108號1樓,03-4916178
吳英錦小兒科診所,桃園市,平鎮區,Moderna,3532100649,桃園市平鎮區龍南路64號,03-4501043
陽明醫院,桃園市,平鎮區,Moderna,1532101091,桃園市平鎮區延平路二段56號,03-4929929
東新診所,桃園市,中壢區,Moderna,3532024411,桃園市中壢區中山東路三段72號,03-4375588
佳國耳鼻喉科診所,桃園市,中壢區,Moderna,3532027172,桃園市中壢區中北路47號1樓,03-4664735
華揚醫院,桃園市,中壢區,Moderna,1532021365,桃園市中壢區中北路二段316號,03-4577200
林國揆小兒科診所,桃園市,中壢區,Moderna,3532025570,桃園市中壢區中北路二段402號,03-4387023
中新小兒科聯合診所,桃園市,中壢區,Moderna,3532022702,桃園市中壢區東興里中北路二段54號,03-4682832
中美醫院,桃園市,中壢區,Moderna,1532021392,桃園市中壢區中美路95號1－3樓(含1樓夾層),03-4266222
宏其醫療社團法人宏其婦幼醫院,桃園市,中壢區,Moderna,932020016,桃園市中壢區元化路223號,03-4618888
周龍生婦產科診所,桃園市,中壢區,Moderna,3532026022,桃園市中壢區元生三街168號1至2樓,03-4515258
陳秋芬親子診所,桃園市,中壢區,Moderna,3532026746,桃園市中壢區文化路359號1樓,03-4552661
聯心診所,桃園市,中壢區,Moderna,3532027305,桃園市中壢區民族路5段310號1樓,03-4205017
活悅診所,桃園市,中壢區,Moderna,3532027574,桃園市中壢區民權路4段281號1至2樓,03-2875902
自立診所,桃園市,中壢區,Moderna,3532025301,桃園市中壢區永福路1051號1樓,03-2853377
懷寧醫院,桃園市,中壢區,Moderna,1532021383,桃園市中壢區志廣路119號及正光街229號1樓,03-4919119
天成醫療社團法人天晟醫院,桃園市,中壢區,Moderna,932020025,桃園市中壢區延平路155號,03-4629292
葉欽池小兒科診所,桃園市,中壢區,Moderna,3532022480,桃園市中壢區延平路553號,03-4222376
敦仁診所,桃園市,中壢區,Moderna,3532027163,桃園市中壢區忠孝路14號、16號、18號1樓,03-4635353
健興診所,桃園市,中壢區,Moderna,3532024564,桃園市中壢區忠孝路80號,03-4630526
長春診所,桃園市,中壢區,Moderna,3532027234,桃園市中壢區長春路122號1樓,03-4331309
佳康診所,桃園市,中壢區,Moderna,3532027501,桃園市中壢區健行路153號1樓,03-4587188
進華小兒科診所,桃園市,中壢區,Moderna,3532024859,桃園市中壢區健行路226號1樓,03-4685858
維坤診所,桃園市,中壢區,Moderna,3532026568,桃園市中壢區健行路226號1樓,03-4685858
康庭診所,桃園市,中壢區,Moderna,3532025758,桃園市中壢區莊敬路811巷6號,03-4336633
王小兒科診所,桃園市,中壢區,Moderna,3532022211,桃園市中壢區慈惠三街117號,03-4227449
黃志焜診所,桃園市,中壢區,Moderna,3532022793,桃園市中壢區慈惠三街135號1樓、2樓,03-4277860
德祐診所,桃園市,中壢區,Moderna,3532024475,桃園市中壢區自強里榮民路10號,03-4353371
中壢長榮醫院,桃園市,中壢區,Moderna,1532021338,桃園市中壢區環中東路150號,03-4631230
黃曉生小兒科診所,桃園市,中壢區,Moderna,3532025187,桃園市中壢區環中東路41、43號,03-4552725
吳家淦耳鼻喉科診所,桃園市,中壢區,Moderna,3532022239,桃園市中壢區中山路21號,03-4272728
活力診所,桃園市,中壢區,Moderna,3532026540,桃園市中壢區莊敬路160號1、2樓,03-2713585
新國民醫療社團法人新國民醫院,桃園市,中壢區,Moderna,932020034,桃園市中壢區復興路152號,03-4225180
翊恩診所,桃園市,中壢區,Moderna,3532026737,桃園市中壢區文化路363號1樓,03-4629078
祐民醫院,桃園市,中壢區,Moderna,1532020215,桃園市中壢區五權里民族路二段180號,03-4915656
昇陽小兒科診所,桃園市,中壢區,Moderna,3532026059,桃園市中壢區六和路12號1樓,03-4228181
同心海華診所,桃園市,中壢區,Moderna,3532027207,桃園市中壢區六和路36號1樓,03-4278960
中原診所,桃園市,中壢區,Moderna,3532025383,桃園市中壢區中山東路一段313號1樓,03-4569788
昭全診所,桃園市,中壢區,Moderna,3532024608,桃園市中壢區龍東路417號,03-4360726
陳坤荃小兒科診所,桃園市,八德區,Moderna,3532080802,桃園市八德區大智里介壽路一段812號,03-3677476
李淵順小兒科診所,桃園市,八德區,Moderna,3532082575,桃園市八德區和義街15號1樓,03-3761123
萬耳鼻喉科診所,桃園市,八德區,Moderna,3532080428,桃園市八德區大忠里介壽路1段913號,03-3635616
晨峰診所,桃園市,八德區,Moderna,3532082655,桃園市八德區永豐路576號1樓,03-3709886
瀚文耳鼻喉科診所,桃園市,八德區,Moderna,3532082217,桃園市八德區桃鶯路5號,03-3641252
楊正全聯合診所,桃園市,八德區,Moderna,3532080928,桃園市八德區介壽路一段833號,03-3626225
李耳鼻喉科診所,桃園市,八德區,Moderna,3532082726,桃園市八德區介壽路一段907號1樓,03-3630063
鴻興診所,桃園市,龜山區,Moderna,3532072088,桃園市龜山區中興路377號1、2樓,03-3205575
長庚醫療財團法人林口長庚紀念醫院,桃園市,龜山區,Moderna,1132070011,桃園市龜山區公西里復興街5號、5之7號、文化一路15號,03-3281200
連淑芳小兒科診所,桃園市,龜山區,Moderna,3532070637,桃園市龜山區萬壽路二段957號1樓,03-3599696
蕭大章診所,桃園市,龜山區,Moderna,3532070422,桃園市龜山區萬壽路二段990號,03-3201860
長庚醫療財團法人桃園長庚紀念醫院,桃園市,龜山區,Moderna,1132071036,桃園市龜山區頂湖路123號、123之1號,03-3196200
南崁現代診所,桃園市,龜山區,Moderna,3532072159,桃園市龜山區南祥路40號1樓,03-3218080
許忠信小兒科診所,桃園市,龜山區,Moderna,3532070333,桃園市龜山區萬壽路二段1095號,03-3505367
日安親子診所,桃園市,龜山區,Moderna,3532072328,桃園市龜山區文化一路10巷41弄1號1樓,03-3277271
德泰診所,桃園市,龜山區,Moderna,3532071867,桃園市龜山區文二一街30號,03-3271566
顏福順診所,桃園市,龜山區,Moderna,3532070593,桃園市龜山區山鶯路15號1－2樓,03-3505638
樂誠診所,桃園市,龜山區,Moderna,3532072622,桃園市龜山區文青二路13號1樓,03-3272703
微笑親子耳鼻喉科診所,桃園市,龜山區,Moderna,3532072506,桃園市龜山區文化二路51號1樓,03-3180022
大明醫院,桃園市,龜山區,Moderna,1532070019,桃園市龜山區龜山里萬壽路二段964號、966號,03-3202792
朱永恆診所,桃園市,龜山區,Moderna,3532072266,桃園市龜山區中興路353號1樓,03-3508182
永樂耳鼻喉科診所,桃園市,龜山區,Moderna,3532072613,桃園市龜山區萬壽路1段107號1樓、109號1樓,02-82000580
卓越耳鼻喉科診所,桃園市,龜山區,Moderna,3532072604,桃園市龜山區萬壽路1段107號1樓、109號1樓,02-82000580
衛生福利部桃園醫院新屋分院,桃園市,新屋區,Moderna,132110519,桃園市新屋區新屋村14鄰新福二路6號,03-4971989
佑生小兒科診所,桃園市,新屋區,Moderna,3532110565,桃園市新屋區新屋里中正路48號,03-4773161
日康診所,桃園市,蘆竹區,Moderna,3532052264,桃園市蘆竹區興榮里桃園街82號1樓,03-2129797
安泰耳鼻喉科診所,桃園市,蘆竹區,Moderna,3532051954,桃園市蘆竹區中山路93號,03-3118478
晨新診所,桃園市,蘆竹區,Moderna,3532051785,桃園市蘆竹區中正路357號一．二．三樓,03-3222232
德信診所,桃園市,蘆竹區,Moderna,3532052031,桃園市蘆竹區奉化路136號1、3樓、138號1樓,03-2220718
佑心親子診所,桃園市,蘆竹區,Moderna,3532052451,桃園市蘆竹區忠孝西路186號1、2樓,03-3126997
全右診所,桃園市,蘆竹區,Moderna,3532051810,桃園市蘆竹區中山路34號1樓,03-2126100
陳俊仁親子診所,桃園市,蘆竹區,Moderna,3532052568,桃園市蘆竹區中正路128號1樓,03-3215866
慶成診所,桃園市,蘆竹區,Moderna,3532052004,桃園市蘆竹區大新路一○七號,03-3137379
愛鄰親子診所,桃園市,蘆竹區,Moderna,3532052273,桃園市蘆竹區南昌路45號1樓,03-3216784
健群診所,桃園市,觀音區,Moderna,3532121791,桃園市觀音區觀音里中正路242號1樓,03-4738658
伍建鴻診所,桃園市,楊梅區,Moderna,3532041761,桃園市楊梅區中興路74號,03-4317549
弘仁小兒科診所,桃園市,楊梅區,Moderna,3532040568,桃園市楊梅區新成路51號,03-4882255
怡仁綜合醫院,桃園市,楊梅區,Moderna,1532040066,桃園市楊梅區楊新北路321巷30號,03-4855566
揚昇小兒科診所,桃園市,楊梅區,Moderna,3532041896,桃園市楊梅區環東路461、463號,03-4755595
姜博文診所,桃園市,楊梅區,Moderna,3532040438,桃園市楊梅區永美路335號1樓、2樓,03-2714920
鄭鈞源診所,桃園市,楊梅區,Moderna,3532040460,桃園市楊梅區新成路二○一之一號,03 4852306
國軍桃園總醫院附設民眾診療服務處,桃園市,龍潭區,Moderna,532090029,桃園市龍潭區中興里中興路168號,03-4799595
龍潭敏盛醫院,桃園市,龍潭區,Moderna,1532091081,桃園市龍潭區中豐路168號,03-4794151
國家中山科學研究院石園診所,桃園市,龍潭區,Moderna,3532091805,桃園市龍潭區文化路六巷35號1樓至3樓,03-4712201
杏德芙診所,桃園市,龍潭區,Moderna,3532091707,桃園市龍潭區北龍路331號1－3樓、333號1－3樓,03-4792430
同安親子診所,桃園市,龍潭區,Moderna,3532091832,桃園市龍潭區中正路284號1樓,03-4707278
平安診所,桃園市,龍潭區,Moderna,3532091565,桃園市龍潭區中正路296號,03-4995763
龍欣耳鼻喉科診所,桃園市,龍潭區,Moderna,3532091654,桃園市龍潭區中正路254號及262號1樓,4808306
徐耳鼻喉科診所,桃園市,龍潭區,Moderna,3532090200,桃園市龍潭區北龍路251號,03-4899631
木子診所,桃園市,大園區,Moderna,3532061825,桃園市大園區致遠一路1號1樓,03-2875875
聯新國際醫院桃園國際機場醫療中心,桃園市,大園區,Moderna,3432060513,桃園市大園區航站南路9號1樓、3樓與15號B1樓、3樓,03-3983456
大園敏盛醫院,桃園市,大園區,Moderna,1532061065,桃園市大園區華中街2號,03-3867521
呂清標診所,桃園市,大園區,Moderna,3532060266,桃園市大園區大園里中正東路34號,03-3865941
張輝鵬診所,桃園市,大溪區,Moderna,3532030464,桃園市大溪區中正東路63號1樓,03 3874422
謝碧祥診所,新竹市,東區,Moderna,3512011187,新竹市東區光復路二段254號,03-5725099
普惠耳鼻喉科,新竹市,東區,Moderna,3512011196,新竹市東區食品路路259號,03-5615151
陳君毅小兒科診所,新竹市,北區,Moderna,3512042208,新竹市北區盤石里西大路738號,03-5345705
啟恩小兒科診所,新竹市,東區,Moderna,3512012728,新竹市東區中央路269號1樓,03-5317177
邱國華耳鼻喉科診所,新竹市,東區,Moderna,3512011267,新竹市東區文華里北大路66號,03-5358758
林安復耳鼻喉科診所,新竹市,東區,Moderna,3512010126,新竹市東區中華路二段一五九號,03-5355890
江婦產科診所,新竹市,東區,Moderna,3512010939,新竹市東區三民里民族路125號,03-5353532
上允耳鼻喉科診所,新竹市,東區,Moderna,3512013887,新竹市東區新莊里光復路一段360之13號1－2樓,03-5777749
林敬堯親子診所,新竹市,北區,Moderna,3512042600,新竹市北區光華里湳雅街120號1樓,03-5350123
陳建銘婦產科診所,新竹市,北區,Moderna,3512040517,新竹市北區武陵路218巷58號,03-5337789
億安診所,新竹市,東區,Moderna,3512013565,新竹市東區三民里民族路112號,03-5353256
廖明厚小兒科診所,新竹市,東區,Moderna,3512011150,新竹市東區民族路130號,03-5316665
賴閔宦小兒科診所,新竹市,東區,Moderna,3512013225,新竹市東區南大路387-1號,03-5611238
謝德貴兒童診所,新竹市,東區,Moderna,3512013645,新竹市東區新莊里光復路一段360之2號,03-6686666
晨心兒科診所,新竹市,東區,Moderna,3512014133,新竹市東區錦華里中央路163號1樓,03-5322066
台灣基督長老教會馬偕醫療財團法人新竹馬偕紀念醫院,新竹市,東區,Moderna,1112010519,新竹市東區光復路二段690號,03-6119595
新仁醫院,新竹縣,竹北市,Moderna,1533051072,新竹縣竹北市博愛街331號,03-5552039
大安醫院,新竹縣,竹北市,Moderna,1533051063,新竹縣竹北市博愛街318巷6號,03-5557188
益康耳鼻喉科診所,新竹縣,竹北市,Moderna,3533052928,新竹縣竹北市成功八路120號1樓,03-6578120
劉信志診所,新竹縣,竹北市,Moderna,3533051627,新竹縣竹北市太康村光明一路二四二號,03-5586518
普懷醫學診所,新竹縣,竹北市,Moderna,3533052722,新竹縣竹北市嘉豐五路一段197號1-2樓,03-5506616
柏安耳鼻喉科診所,新竹縣,竹北市,Moderna,3533051510,新竹縣竹北市嘉豐六路一段31號1樓,03-6681531
惠慎診所,新竹縣,竹北市,Moderna,3533052044,新竹縣竹北市光明九路9-15號1至3樓,03-6571515
瑞麟診所,新竹縣,竹北市,Moderna,3533050460,新竹縣竹北市中山路460號1Ｆ,03-5536286
洪瑞聰小兒專科診所,新竹縣,竹北市,Moderna,3533052222,新竹縣竹北市成功八路100號,03-6676287
曾文智診所,新竹縣,竹北市,Moderna,3533050380,新竹縣竹北市中正西路31號,03-5553549
艾兒診所,新竹縣,竹北市,Moderna,3533052491,新竹縣竹北市福興東路二段140號1樓,03-6586699
傅仁良小兒科診所,新竹縣,竹北市,Moderna,3533051547,新竹縣竹北市博愛街172號,03-5530106
麥建方小兒專科診所,新竹縣,竹北市,Moderna,3533051903,新竹縣竹北市勝利五路27號,03-6577261
游丞顯小兒科診所,新竹縣,竹北市,Moderna,3533051921,新竹縣竹北市文興路一段78號1、2樓,03-6583300
張嘉榮診所,新竹縣,竹北市,Moderna,3533051770,新竹縣竹北市光明1路392之1號1樓,03-5586859
彭福麒小兒科診所,新竹縣,竹北市,Moderna,3533050273,新竹縣竹北市博愛街376號,03-5510032
