賴俊良骨外科診所,臺南市,安南區,BioNTech,3521060858,臺南市安南區新順里安和路2段267號1樓,06-3559260
黃德真診所,臺南市,安南區,BioNTech,3521060885,臺南市安南區城北里安中路六段710號1樓,06-2574678
許文錦家庭醫學科診所,臺南市,安南區,BioNTech,3521060929,臺南市安南區同安路400號,06-2455511
張銘顯診所,臺南市,安南區,BioNTech,3521060947,臺南市安南區安和路三段92號,06-3559613
陳本全家庭醫學科診所,臺南市,安南區,BioNTech,3521060983,臺南市安南區溪心里安中路三段41號1樓,06-2558673
怡安小兒科診所,臺南市,安南區,BioNTech,3521062192,臺南市安南區鳳凰里怡安路二段511號1樓,06-2456657
家佳診所,臺南市,安南區,BioNTech,3521062236,臺南市安南區安中路三段399號,06-2462507
郭文山家庭醫學婦產科診所,臺南市,安南區,BioNTech,3521062316,臺南市安南區海佃路2段648號1樓,06-2560688
長逸小兒科診所,臺南市,安南區,BioNTech,3521062334,臺南市安南區安和路4段525號1樓,06-3552277
魏大倫耳鼻喉科診所,臺南市,安南區,BioNTech,3521062389,臺南市安南區安和路1段356號1樓,06-2568119
海東小兒科診所,臺南市,安南區,BioNTech,3521062423,臺南市安南區安中路3段355號1樓,06-2561399
陳昱成耳鼻喉科診所,臺南市,安南區,BioNTech,3521062478,臺南市安南區海佃路1段196號1樓,06-2800178
蔡添祥耳鼻喉科診所,臺南市,安南區,BioNTech,3521062487,臺南市安南區溪墘里海佃路1段90號1樓,06-3587722
黃義盛小兒科診所,臺南市,安平區,BioNTech,3505380140,臺南市安平區平安里民權路四段141號1樓,06-2599589
宏安耳鼻喉科診所,臺南市,安平區,BioNTech,3505380211,臺南市安平區華平里華平路575號1樓,06-2986262
白袍旅人兒科診所,臺南市,安平區,BioNTech,3505380266,臺南市安平區國平里華平路146─5號1樓,06-2970500
健全診所,臺南市,安平區,BioNTech,3521070149,臺南市安平區平通路444號,06-2973333
穠田聯合診所,臺南市,安平區,BioNTech,3521070327,臺南市安平區永華路二段1059號1、2樓,06-2950808
慶平美耳鼻喉科診所,臺南市,安平區,BioNTech,3521071342,臺南市安平區慶平路559號,06-2976670
陽光小兒科診所,臺南市,安平區,BioNTech,3521071422,臺南市安平區華平路501號1樓,06-2937711
周恭維診所,臺南市,安平區,BioNTech,3521071440,臺南市安平區華平路595號,06-2938599
吳國堯小兒科診所,臺南市,安平區,BioNTech,3521071520,臺南市安平區文平路438號1樓,06-2933358
同心小兒科診所,臺南市,安平區,BioNTech,3521071539,臺南市安平區國平路306號1樓,06-2993699
台南市安平區衛生所,臺南市,安平區,BioNTech,2321070019,臺南市安平區平通里育平路310號,06-2996885
永川醫院,臺南市,中西區,BioNTech,1521050010,臺南市中區觀音里成功路169號,06-2245771
永和醫院,臺南市,中西區,BioNTech,1521051160,臺南市中區福安里府前路一段304巷2號,06-2231191
陳俊達小兒科診所,臺南市,中西區,BioNTech,3505340226,臺南市中西區中山路19、21、21－1號1樓,06-2221867
李朝泰小兒科診所,臺南市,中西區,BioNTech,3521030378,臺南市中西區普濟里成功路319號,06-2256618
郭宗男婦產科診所,臺南市,中西區,BioNTech,3521030396,臺南市中西區金華路三段124號,06-2295230
湖美耳鼻喉科診所,臺南市,中西區,BioNTech,3521030467,臺南市西區湖美街215巷9號,06-2801561
呂宗禧耳鼻喉科診所,臺南市,中西區,BioNTech,3521031722,臺南市中西區民權路1段261號1樓,06-2282155
光明內科診所,臺南市,中西區,BioNTech,3521031768,臺南市中西區萬昌里府前路1段80號1、2樓,06-2245555
蘇文彬婦產科診所,臺南市,中西區,BioNTech,3521050218,臺南市中西區西門路一段670號,06-2155155
郭重德診所,臺南市,中西區,BioNTech,3521050638,臺南市中西區民生路一段90號,06-2262953
張永昌小兒科診所,臺南市,中西區,BioNTech,3521051528,臺南市中西區新美街66之1號,06-2292360
紀冠廷診所,臺南市,中西區,BioNTech,3521052678,臺南市中西區青年路119號,06-2263931
康健內兒科診所,臺南市,中西區,BioNTech,3521052838,臺南市中西區健康路一段176號1－6樓,06-2146929
小天使婦兒診所,臺南市,中西區,BioNTech,3521052930,臺南市中西區府前一街9巷14號1樓,06-2930888
郭綜合醫院,臺南市,中西區,BioNTech,1521031104,臺南市民生路二段18．20．22．23．24．25．27號,06-2221111
臺南市中西區衛生所,臺南市,中西區,BioNTech,2321030015,臺南市中西區淺草里環河街94號Ｂ1～3樓,06-2252403
賴政友診所,嘉義縣,民雄鄉,BioNTech,3540040036,嘉義縣民雄鄉東榮村和平路9號,05-2262624
懷仁耳鼻喉科診所,嘉義縣,民雄鄉,BioNTech,3540041800,嘉義縣民雄鄉西安村西安路46－21號,05-2265000
國泰診所,嘉義縣,民雄鄉,BioNTech,3540041668,嘉義縣民雄鄉福樂村埤角519號1樓,05-2215260
黃威雄耳鼻喉科診所,嘉義縣,民雄鄉,BioNTech,3540041766,嘉義縣民雄鄉興南村4鄰建國路三段191號1樓,05-2133556
奕安診所,嘉義縣,民雄鄉,BioNTech,3540040376,嘉義縣民雄鄉興南村頭橋557之31號,05-2204885
蕭賜彥診所,嘉義縣,民雄鄉,BioNTech,3540040161,嘉義縣民雄鄉福樂村建國路三段252號,05-2200858
張介山診所,嘉義縣,民雄鄉,BioNTech,3540041480,嘉義縣民雄鄉東榮村民族路22之3號,05-2261302
錦洲診所,嘉義縣,溪口鄉,BioNTech,3540050050,嘉義縣溪口鄉溪東村民生街56號,05-2696058
陳景昇診所,嘉義縣,溪口鄉,BioNTech,3540050078,嘉義縣溪口鄉坪頂村溪民路19號,05-2697296
柯診所,嘉義縣,中埔鄉,BioNTech,3540131452,嘉義縣中埔鄉中埔村16鄰170－25號,05-2531616
宏恩診所,嘉義縣,中埔鄉,BioNTech,3540130295,嘉義縣中埔鄉中埔村中正路38號,05-2532722
佳誼小兒科診所,嘉義縣,中埔鄉,BioNTech,3540131390,嘉義縣中埔鄉和睦村中山路五段697號,05-2391096
華德診所,嘉義縣,中埔鄉,BioNTech,3540130259,嘉義縣中埔鄉和美村中山路五段804號,05-2306760
臺中榮民總醫院灣橋分院,嘉義縣,竹崎鄉,BioNTech,640140012,嘉義縣竹崎鄉灣橋村石麻園38號,05-2791072
賜安診所,嘉義縣,水上鄉,BioNTech,3540121278,嘉義縣水上鄉正義路53號,05-2600934
崇德家庭醫學科診所,嘉義縣,布袋鎮,BioNTech,3540020025,嘉義縣布袋鎮東安里76之3號,05-3451341
尚群診所,嘉義縣,朴子市,BioNTech,3503090170,臺中市潭子區中山路二段384-6號B1、1、2、3、4樓,04-25340830
王士虹小兒科診所,嘉義縣,朴子市,BioNTech,3540010332,嘉義縣朴子市平和里山通路41號,05-3700539
德家診所,嘉義縣,朴子市,BioNTech,3540011599,嘉義縣朴子市平和路11－6號1－2樓,05-3707190
鼎和診所,嘉義縣,朴子市,BioNTech,3540011535,嘉義縣朴子市八德路43號1樓、45號1樓,05-3661101
衛生福利部朴子醫院,嘉義縣,朴子市,BioNTech,140010028,嘉義縣朴子市永和里42－50號,05-3790600
嘉德診所,嘉義縣,太保市,BioNTech,3540111147,嘉義縣太保市北新里中山路1段578號,05-2370405
定安診所,嘉義縣,太保市,BioNTech,3540111272,嘉義縣太保市麻寮里中山路一段311之5號1樓,05-2377771
文詠診所,嘉義縣,太保市,BioNTech,3540111316,嘉義縣太保市北港路二段166－21,05-2385099
吳振維診所,嘉義縣,太保市,BioNTech,3540111325,嘉義縣太保市北新里17鄰中山路一段590號,05-2380101
祥和診所,嘉義縣,太保市,BioNTech,3540111307,嘉義縣太保市安仁里11鄰太保二路157號1樓及159號1樓,05-3621712
惠生診所,嘉義縣,太保市,BioNTech,3540111290,嘉義縣太保市北新里17鄰中山路一段802號,05-2371133
超群診所,嘉義縣,太保市,BioNTech,3540111138,嘉義縣太保市春珠里164之10號,05-3716323
昌模小兒科診所,嘉義縣,新港鄉,BioNTech,3540060207,嘉義縣新港鄉大興村福德路20號,05-3740369
李龍駒診所,嘉義縣,新港鄉,BioNTech,3540060190,嘉義縣新港鄉福德村9鄰中山路72巷18、20號,05-3747911
嘉其耳鼻喉科診所,嘉義縣,新港鄉,BioNTech,3540061295,嘉義縣新港鄉登雲路50號,05-3746800
新昆明醫院,基隆市,中正區,BioNTech,1511010068,基隆市中正區中正路30號,02-24268106
醫療財團法人臺灣區煤礦業基金會礦工基隆診所,基隆市,中正區,BioNTech,3511010480,基隆市中正區義一路76號3、4樓,02-24220506
晉安診所,基隆市,中正區,BioNTech,3511012242,基隆市中正區義一路39號1樓,02-24268178
王立文婦產科診所,基隆市,中正區,BioNTech,3511010202,基隆市中正區義一路41號1、2、3、5、6、7樓,02-24278888
陳如儀兒科診所,基隆市,中正區,BioNTech,3511012073,基隆市中正區義一路62號1樓,02-24259958
博群診所,基隆市,中正區,BioNTech,3511010702,基隆市中正區新豐街446號,02-24601356
林承興診所,基隆市,中正區,BioNTech,3511010524,基隆市中正區北寧路319號,02-24694199
紀醫師診所,基隆市,七堵區,BioNTech,3511020226,基隆市七堵區開元路83號,02-24554195
正光診所,基隆市,七堵區,BioNTech,3511021607,基隆市七堵區南興路12號1樓,02-24569275
群健診所,基隆市,七堵區,BioNTech,3511021545,基隆市七堵區開元路59之1號地面1、3樓,02-24568190
廖內兒科診所,基隆市,七堵區,BioNTech,3511020066,基隆市七堵區南興路101號,02-24564621
西華診所,基隆市,七堵區,BioNTech,3511020333,基隆市七堵區百三街29號,02-24512942
杏福診所,基隆市,七堵區,BioNTech,3511021616,基隆市七堵區福二街320號,02-24528089
醫療財團法人臺灣區煤礦業基金會臺灣礦工醫院,基隆市,暖暖區,BioNTech,1411030013,基隆市暖暖區源遠路29號,02-24579101
碇內診所,基隆市,暖暖區,BioNTech,3511031247,基隆市暖暖區源遠路323號,02-24595878
康合診所,基隆市,暖暖區,BioNTech,3511031256,基隆市暖暖區源遠路281－1號,02-24592200
婁診所,基隆市,暖暖區,BioNTech,3511030053,基隆市暖暖區暖暖街171號,02-24584498
王孟俊診所,基隆市,仁愛區,BioNTech,3511040639,基隆市仁愛區南榮路143號,02-24293128
仁愛診所,基隆市,仁愛區,BioNTech,3511041181,基隆市仁愛區孝三路80號,02-24223255
喜聖診所,基隆市,仁愛區,BioNTech,3511041485,基隆市仁愛區劉銘傳路1-5號6樓,02-24287378
仁祥診所,基隆市,仁愛區,BioNTech,3511041396,基隆市仁愛區忠一路20號1-3樓及23號1樓,02-24232111
安定診所,基隆市,中山區,BioNTech,3511051507,基隆市中山區安一路90號,02-24213279
至誠診所,基隆市,中山區,BioNTech,3511050108,基隆市中山區安一路3號,02-24246151
林義宏診所,基隆市,中山區,BioNTech,3511050260,基隆市中山區復興路263號,02-24366481
仁傑小兒專科診所,基隆市,中山區,BioNTech,3511051454,基隆市中山區安一路49號,02-24254123
長庚醫療財團法人基隆長庚紀念醫院,基隆市,安樂區,BioNTech,1111060015,基隆市安樂區麥金路222號、基隆市麥金路201號,02-24313131
李卓為診所,基隆市,安樂區,BioNTech,3511060159,基隆市安樂區基金一路133－5號1樓,02-24332900
李偉華耳鼻喉科診所,基隆市,安樂區,BioNTech,3511061325,基隆市安樂區安樂路2段179號,02-24348535
衛生福利部基隆醫院,基隆市,信義區,BioNTech,111070010,基隆市信義區信二路268號,02-24292525
國泰家醫診所,基隆市,信義區,BioNTech,3511071410,基隆市信義區信一路115號,02-24254195
黃振國診所,基隆市,信義區,BioNTech,3511070191,基隆市信義區東信路218號,02-24669255
長庚醫療財團法人台北長庚紀念醫院,臺北市,松山區,BioNTech,1101010012,臺北市松山區敦化北路199號,02-27135211
基督復臨安息日會醫療財團法人臺安醫院,臺北市,松山區,BioNTech,1101010021,臺北市松山區八德路2段424、426號,02-27718151
博仁綜合醫院,臺北市,松山區,BioNTech,1501010010,臺北市松山區光復北路66、68號,02-25786677
臺北醫學大學附設醫院,臺北市,信義區,BioNTech,1301170017,臺北市信義區吳興街252號、250號,02-27372181
中心診所醫療財團法人中心綜合醫院,臺北市,大安區,BioNTech,1101020027,臺北市大安區忠孝東路4段77號,02-27510221
中山醫療社團法人中山醫院,臺北市,大安區,BioNTech,901020013,臺北市大安區仁愛路4段112巷11號,02-27081166
國泰醫療財團法人國泰綜合醫院,臺北市,大安區,BioNTech,1101020018,臺北市大安區仁愛路4段280號，266巷6號,02-27082121
秀傳醫院,臺北市,大安區,BioNTech,1501021219,臺北市大安區光復南路116巷1、3、5號1至4樓及地下1樓,02-27717172
宏恩醫療財團法人宏恩綜合醫院,臺北市,大安區,BioNTech,1101020036,臺北市大安區仁愛路4段71巷1號及4段61號、91巷16號,02-27713161
台灣基督長老教會馬偕醫療財團法人馬偕紀念醫院,臺北市,中山區,BioNTech,1101100011,臺北市中山區中山北路2段92號,02-25433535
郵政醫院（委託中英醫療社團法人經營）,臺北市,中正區,BioNTech,901180023,臺北市中正區福州街14號,02-23956755
財團法人台灣省私立台北仁濟院附設仁濟醫院,臺北市,萬華區,BioNTech,1401190011,臺北市萬華區廣州街200、243號,02-23021133
國立臺灣大學醫學院附設醫院北護分院,臺北市,萬華區,BioNTech,401190010,臺北市萬華區康定路37號、臺北市萬華區內江街87號,02-23717101
臺北市立萬芳醫院－委託財團法人臺北醫學大學辦理,臺北市,文山區,BioNTech,1301200010,臺北市文山區興隆路3段111號,02-29307930
景美醫院,臺北市,文山區,BioNTech,1501201020,臺北市文山區羅斯福路6段280號及文山區育英街18巷2號1樓,02-29331010
新光醫療財團法人新光吳火獅紀念醫院,臺北市,士林區,BioNTech,1101150011,臺北市士林區文昌路95號及士商路51號1至7樓53、55號,02-28332211
臺北榮民總醫院,臺北市,北投區,BioNTech,601160016,臺北市北投區石牌路2段201號,02-28712121
臺北市立聯合醫院附設松山門診部,臺北市,松山區,BioNTech,2101010013,臺北市松山區八德路4段694號1、2樓,02-27653147
弘光耳鼻喉科診所,臺北市,松山區,BioNTech,3501014225,臺北市松山區民生東路4段117號,02-27181177
謝耳鼻喉科診所,臺北市,松山區,BioNTech,3501010227,臺北市松山區民生東路5段148號2樓,02-27697891
劉內兒科診所,臺北市,松山區,BioNTech,3501010094,臺北市松山區民生東路5段148號,02-27603922
詹前俊小兒科診所,臺北市,松山區,BioNTech,3501010816,臺北市松山區民生東路5段105號,02-27653039
江崇萍小兒科診所,臺北市,松山區,BioNTech,3501011260,臺北市松山區南京東路5段251巷24弄27號,02-27632260
車參薇小兒科診所,臺北市,松山區,BioNTech,3501011493,臺北市松山區八德路3段195號1樓,02-25770101
閎新耳鼻喉科皮膚科聯合診所,臺北市,松山區,BioNTech,3501012838,臺北市松山區八德路3段20－2號,02-25779898
陳炳堅內科診所,臺北市,松山區,BioNTech,3501010763,臺北市松山區延壽街327號,02-27637199
吳慶南內科診所,臺北市,松山區,BioNTech,3501010932,臺北市松山區民生東路5段138巷1號,02-27659566
王躬仁診所,臺北市,松山區,BioNTech,3501011466,臺北市松山區新中街12－3號1樓,02-27646685
澄東耳鼻喉科診所,臺北市,松山區,BioNTech,3501014823,臺北市松山區三民路37號,02-27420552
駿昂耳鼻喉科診所,臺北市,松山區,BioNTech,3501014976,臺北市松山區八德路2段395號,02-87728086
佑家診所,臺北市,松山區,BioNTech,3501015026,臺北市松山區八德路3段233號,02-25785658
安兒康小兒專科診所,臺北市,松山區,BioNTech,3501015035,臺北市松山區敦化北路116號、118號、118號2樓,02-77287688
悅昇小兒科診所,臺北市,松山區,BioNTech,3501015213,臺北市松山區民生東路3段101號2樓、2樓之1及2樓之2,02-27125977
弘宇診所,臺北市,松山區,BioNTech,3501015133,臺北市松山區民權東路3段160巷7號,02-27128875
康瑞耳鼻喉科診所,臺北市,松山區,BioNTech,3501010834,臺北市松山區八德路3段154號1樓,02-25790045
登瑞安診所,臺北市,信義區,BioNTech,3501173336,臺北市信義區林口街232號1樓,02-27265228
林應然小兒科診所,臺北市,信義區,BioNTech,3501173425,臺北市信義區福德街75號,02-27595328
新穎全診所,臺北市,信義區,BioNTech,3501173685,臺北市信義區和平東路3段265號,02-27325809
聯合報系員工診療所,臺北市,信義區,BioNTech,3401171107,臺北市信義區忠孝東路4段559巷1號6樓,02-27601618
長風小兒科診所,臺北市,信義區,BioNTech,3501171716,臺北市信義區莊敬路351號1樓,02-27227943
王寬仁診所,臺北市,信義區,BioNTech,3501171010,臺北市信義區虎林街121巷11號1樓,02-27204952
張育驍診所,臺北市,信義區,BioNTech,3501171225,臺北市信義區吳興街467巷2弄4號、6號、6號2樓、10號,02-27291011
總站18號診所,臺北市,信義區,BioNTech,3501174708,臺北市信義區吳興街467巷2弄4號、6號、6號2樓、10號,02-27296611
黃啟彰診所,臺北市,信義區,BioNTech,3501170835,臺北市信義區松山路261－1號1樓,02-27696218
大明診所,臺北市,信義區,BioNTech,3501171654,臺北市信義區崇德街35號,02-27326885
明輝診所,臺北市,信義區,BioNTech,3501173327,臺北市信義區松隆路282之3號,02-87871235
朱耳鼻喉科診所,臺北市,信義區,BioNTech,3501170255,臺北市信義區忠孝東路5段452號,02-27209172
董耳鼻喉科診所,臺北市,信義區,BioNTech,3501170380,臺北市信義區永吉路284號1樓,02-27643502
莊敬診所,臺北市,信義區,BioNTech,3501174815,臺北市信義區莊敬路280號,02-27589258
永吉羅耳鼻喉科診所,臺北市,信義區,BioNTech,3501174806,臺北市信義區永吉路272號,02-27683191
桂其安家醫科診所,臺北市,信義區,BioNTech,3501175223,臺北市信義區莊敬路462號,02-27229173
松仁耳鼻喉科診所,臺北市,信義區,BioNTech,3501172848,臺北市信義區松仁路231號,02-87808580
陳威璋耳鼻喉科診所,臺北市,信義區,BioNTech,3501171270,臺北市信義區松德路58號,02-27584958
?麗恆全人診所,臺北市,信義區,BioNTech,3501175385,臺北市信義區忠孝東路5段431號2樓,02-27657065
福德郭耳鼻喉科診所,臺北市,信義區,BioNTech,3501173416,臺北市信義區福德街62號,02-2759-1051
嚴敏心耳鼻喉科診所,臺北市,信義區,BioNTech,3501175465,臺北市信義區松山路541巷4號（1樓）,02-27279558
松德診所,臺北市,大安區,BioNTech,3501029931,臺北市大安區四維路170巷16號,02-27073326
邱醫師診所,臺北市,大安區,BioNTech,3501029351,臺北市大安區和平東路3段288號,02-27392696
夏爾診所,臺北市,大安區,BioNTech,350102A107,臺北市大安區信義路4段265巷52號、54號,02-23255508
健華診所,臺北市,大安區,BioNTech,3501029922,臺北市大安區和平東路2段299號（實際營業地址：1樓）,02-27072990
許靜瑛小兒科診所,臺北市,大安區,BioNTech,3501028050,臺北市大安區和平東路1段230號1樓,02-23629088
吳坤光婦產科診所,臺北市,大安區,BioNTech,3501021239,臺北市大安區信義路4段59號,02-27059321
林繼國診所,臺北市,大安區,BioNTech,3501021720,臺北市大安區忠孝東路3段217巷1弄12號1樓,02-27315568
尹書田醫療財團法人書田泌尿科眼科診所,臺北市,大安區,BioNTech,4001020028,臺北市大安區建國南路2段276號1樓、278號1樓,02-23690211
黃文香兒科診所,臺北市,大安區,BioNTech,3501029628,臺北市大安區忠孝東路4段250號2樓之1,02-27313305
那明珠診所,臺北市,大安區,BioNTech,3501028845,臺北市大安區和平東路3段8號,02-27360589
劉建宏診所,臺北市,大安區,BioNTech,3501027491,臺北市大安區大安路2段139號,02-27002368
仁安診所,臺北市,大安區,BioNTech,3501022496,臺北市大安區和平東路2段175巷34號1樓,02-27065995
臺北市立聯合醫院附設大安門診部,臺北市,大安區,BioNTech,2101020019,臺北市大安區辛亥路3段15號,02-27390997
啟誠聯合診所,臺北市,大安區,BioNTech,3501022843,臺北市大安區和平東路2段120號1．2．3，4樓,02-23784380
智博診所,臺北市,大安區,BioNTech,350102C389,臺北市大安區信義路4段265巷11號,02-27099097
全家聯合診所,臺北市,大安區,BioNTech,3501021391,臺北市大安區和平東路2段353號,02-27067575
周大中婦產科診所,臺北市,大安區,BioNTech,3501026396,臺北市大安區敦化南路二段四十六號二樓,02-27552757
博全婦產科診所,臺北市,大安區,BioNTech,3501021640,臺北市大安區大安路一段18號、16巷1、1-1、3、3-1、5、5-1號2樓,02-227774437
禾馨新生婦幼診所,臺北市,大安區,BioNTech,350102B364,臺北市大安區新生南路3段2號、2號2樓、2號3樓,02-23682333
林青穀家庭醫學科診所,臺北市,大安區,BioNTech,3501021480,臺北市大安區大安路1段2－1號,02-27317557
佳音診所,臺北市,大安區,BioNTech,3501022914,臺北市大安區復興南路1段261之3號1樓,02-27054430
李細祥內科診所,臺北市,大安區,BioNTech,350102D135,臺北市大安區四維路198巷30弄5號,02-27018159
樂活診所,臺北市,大安區,BioNTech,350102F157,臺北市大安區師大路12號（實際營業地址：1樓、3樓）,02-23683883
安東診所,臺北市,大安區,BioNTech,350102F184,臺北市大安區和平東路2段98之1號,02-23786111
杏保醫網信誠診所,臺北市,大安區,BioNTech,350102F719,臺北市大安區信義路4段197號、199巷2號,02-27068208
微笑寶貝診所,臺北市,大安區,BioNTech,350102F906,臺北市大安區和平東路1段99號（1樓）,02-23938280
呂小兒科診所,臺北市,大安區,BioNTech,3501024918,臺北市大安區通化街24巷6號1樓,02-27000708
安民家庭醫學科診所,臺北市,大安區,BioNTech,350102E445,臺北市大安區大安路1段65號2樓之1,02-27218556
櫟安診所,臺北市,大安區,BioNTech,350102F513,臺北市大安區金山南路2段200號11樓,02-23582138
李義男婦產科診所,臺北市,中山區,BioNTech,3501101492,臺北市中山區中山北路二段７１號４樓,02-225239923
大直診所,臺北市,中山區,BioNTech,3501103272,臺北市中山區北安路595巷2弄2號（1樓及地下層）及6號,02-25332339
臺北市立聯合醫院附設中山門診部,臺北市,中山區,BioNTech,2101100227,臺北市中山區松江路367號1樓,02-25013363
中崙聯合診所,臺北市,中山區,BioNTech,3501100182,臺北市中山區八德路2段303號1樓、305號307號1及2樓,02-27711501
莊宇龍診所,臺北市,中山區,BioNTech,3501105445,臺北市中山區北安路637號,02-25331255
大直佳恩診所,臺北市,中山區,BioNTech,3501107725,臺北市中山區北安路591號1樓及地下層,02-25323301
雙連婦產科小兒科診所,臺北市,中山區,BioNTech,3501107565,臺北市中山區民生西路30號4樓,02-25222381
晴光診所,臺北市,中山區,BioNTech,3501107369,臺北市中山區林森北路556號,02-25853210
杏慈診所,臺北市,中山區,BioNTech,3501106559,臺北市中山區民權東路2段152巷2之1號,02-25013109
榮星診所,臺北市,中山區,BioNTech,3501107574,臺北市中山區龍江路272號及274號,02-25168112
愛鄰診所,臺北市,中山區,BioNTech,3501105767,臺北市中山區北安路520－1號,02-25322333
聖和骨外科診所,臺北市,中山區,BioNTech,3501107501,臺北市中山區農安街138之1號、140號,02-25969131
鄭志誠小兒科診所,臺北市,中山區,BioNTech,3501103585,臺北市中山區民生東路1段8號,02-25512246
寧康聯合診所,臺北市,中山區,BioNTech,3501103665,臺北市中山區龍江路209巷6之1號,02-25013862
北安聯合診所,臺北市,中山區,BioNTech,3501101849,臺北市中山區北安路569之1號2樓．之2、3、4號1、2樓,02-25337777
樂群診所,臺北市,中山區,BioNTech,3501108875,臺北市中山區樂群二路210之2號1樓,02-85012268
吳振力診所,臺北市,中山區,BioNTech,3501103978,臺北市中山區長春路309號,02-25095909
陳世澤內科診所,臺北市,中山區,BioNTech,3501102364,臺北市中山區龍江路284－1號,02-25011239
宗北內科診所,臺北市,中山區,BioNTech,3501102622,臺北市中山區民生西路24號2樓,02-25411001
慶恩小兒科診所,臺北市,中山區,BioNTech,3501104091,臺北市中山區吉林路117號,02-25683199
農安診所,臺北市,中山區,BioNTech,3501106264,臺北市中山區農安街62號,02-25978590
德美診所,臺北市,中山區,BioNTech,3501103334,臺北市中山區北安路596號1樓,02-25326618
慶生診所,臺北市,中山區,BioNTech,3501106782,臺北市中山區林森北路561號2樓之7及之8,02-25983456
李宜霖診所,臺北市,中山區,BioNTech,3501109130,臺北市中山區植福路296號、298號、308號3樓之5,02-26582669
正恩耳鼻喉科診所,臺北市,中山區,BioNTech,3501103414,臺北市中山區錦州街321號,02-25052293
葉小兒科診所,臺北市,中山區,BioNTech,3501100986,臺北市中山區長春路２２７號,02-250548333
臺北市立聯合醫院附設中正門診部,臺北市,中正區,BioNTech,2101180038,臺北市中正區牯嶺街24號,02-23210168
朱小兒科診所,臺北市,中正區,BioNTech,3501181267,臺北市中正區汀州路2段220號1樓,02-23651810
悅心診所,臺北市,中正區,BioNTech,3501184393,臺北市中正區羅斯福路2段7之2號、7之3號,02-23961008
周正成小兒科診所,臺北市,中正區,BioNTech,3501181810,臺北市中正區徐州路24號,02-23516830
同泰診所,臺北市,中正區,BioNTech,3501181589,臺北市中正區汀州路2段136，138號,02-23678511
怡和診所,臺北市,中正區,BioNTech,3501183547,臺北市中正區汀州路2段212號,02-23625100
